{
  "schema_version": "1.0",
  "image_id": "image",
  "profile": "geometry-v1",
  "coordinate_system": {
    "origin": "top_left",
    "x_direction": "right",
    "y_direction": "down",
    "unit": "pixel",
    "image_width": 600,
    "image_height": 450,
    "bbox_format": "left_top_right_bottom_inclusive"
  },
  "primitives": [
    {
      "primitive_id": "geometry.rectangle.plate",
      "type": "rectangle",
      "bbox": {
        "left": 112,
        "top": 102,
        "right": 488,
        "bottom": 348
      },
      "geometry": {
        "bounds": {
          "left": 112,
          "top": 102,
          "right": 488,
          "bottom": 348
        }
      },
      "confidence": 0.95,
      "attributes": {
        "kind": "plate",
        "pixel_count": 88514
      },
      "source_refs": [
        {
          "graph": "domain_evidence",
          "collection": "regions",
          "object_id": "plate"
        }
      ]
    },
    {
      "primitive_id": "geometry.circle.hole-01",
      "type": "circle",
      "bbox": {
        "left": 163,
        "top": 208,
        "right": 197,
        "bottom": 242
      },
      "geometry": {
        "center": [
          180,
          225
        ],
        "radius": 20.65
      },
      "confidence": 0.9,
      "attributes": {
        "diameter_px": 41.3,
        "circularity": 0.013,
        "pixel_count": 973
      },
      "source_refs": [
        {
          "graph": "domain_evidence",
          "collection": "holes",
          "object_id": "hole-01"
        }
      ]
    },
    {
      "primitive_id": "geometry.text.hole-01",
      "type": "text_region",
      "bbox": {
        "left": 145,
        "top": 257,
        "right": 215,
        "bottom": 279
      },
      "geometry": {
        "bounds": {
          "left": 145,
          "top": 257,
          "right": 215,
          "bottom": 279
        }
      },
      "confidence": 0.89,
      "attributes": {
        "text": "D10"
      },
      "source_refs": [
        {
          "graph": "domain_evidence",
          "collection": "holes",
          "object_id": "hole-01"
        }
      ]
    },
    {
      "primitive_id": "geometry.circle.hole-02",
      "type": "circle",
      "bbox": {
        "left": 283,
        "top": 178,
        "right": 317,
        "bottom": 212
      },
      "geometry": {
        "center": [
          300,
          195
        ],
        "radius": 20.65
      },
      "confidence": 0.9,
      "attributes": {
        "diameter_px": 41.3,
        "circularity": 0.013,
        "pixel_count": 973
      },
      "source_refs": [
        {
          "graph": "domain_evidence",
          "collection": "holes",
          "object_id": "hole-02"
        }
      ]
    },
    {
      "primitive_id": "geometry.text.hole-02",
      "type": "text_region",
      "bbox": {
        "left": 265,
        "top": 227,
        "right": 335,
        "bottom": 249
      },
      "geometry": {
        "bounds": {
          "left": 265,
          "top": 227,
          "right": 335,
          "bottom": 249
        }
      },
      "confidence": 0.89,
      "attributes": {
        "text": "D10"
      },
      "source_refs": [
        {
          "graph": "domain_evidence",
          "collection": "holes",
          "object_id": "hole-02"
        }
      ]
    },
    {
      "primitive_id": "geometry.circle.hole-03",
      "type": "circle",
      "bbox": {
        "left": 403,
        "top": 208,
        "right": 437,
        "bottom": 242
      },
      "geometry": {
        "center": [
          420,
          225
        ],
        "radius": 20.65
      },
      "confidence": 0.9,
      "attributes": {
        "diameter_px": 41.3,
        "circularity": 0.013,
        "pixel_count": 973
      },
      "source_refs": [
        {
          "graph": "domain_evidence",
          "collection": "holes",
          "object_id": "hole-03"
        }
      ]
    },
    {
      "primitive_id": "geometry.text.hole-03",
      "type": "text_region",
      "bbox": {
        "left": 385,
        "top": 257,
        "right": 455,
        "bottom": 279
      },
      "geometry": {
        "bounds": {
          "left": 385,
          "top": 257,
          "right": 455,
          "bottom": 279
        }
      },
      "confidence": 0.89,
      "attributes": {
        "text": "D10"
      },
      "source_refs": [
        {
          "graph": "domain_evidence",
          "collection": "holes",
          "object_id": "hole-03"
        }
      ]
    }
  ],
  "relationships": [
    {
      "relationship_id": "geometry.inside.hole-01.plate",
      "type": "inside",
      "source_primitive_id": "geometry.circle.hole-01",
      "target_primitive_id": "geometry.rectangle.plate",
      "confidence": 0.9,
      "measurements": {},
      "supporting_primitive_ids": []
    },
    {
      "relationship_id": "geometry.connected_to.hole-01.label",
      "type": "connected_to",
      "source_primitive_id": "geometry.text.hole-01",
      "target_primitive_id": "geometry.circle.hole-01",
      "confidence": 0.89,
      "measurements": {
        "role": "dimension_label"
      },
      "supporting_primitive_ids": []
    },
    {
      "relationship_id": "geometry.inside.hole-02.plate",
      "type": "inside",
      "source_primitive_id": "geometry.circle.hole-02",
      "target_primitive_id": "geometry.rectangle.plate",
      "confidence": 0.9,
      "measurements": {},
      "supporting_primitive_ids": []
    },
    {
      "relationship_id": "geometry.connected_to.hole-02.label",
      "type": "connected_to",
      "source_primitive_id": "geometry.text.hole-02",
      "target_primitive_id": "geometry.circle.hole-02",
      "confidence": 0.89,
      "measurements": {
        "role": "dimension_label"
      },
      "supporting_primitive_ids": []
    },
    {
      "relationship_id": "geometry.inside.hole-03.plate",
      "type": "inside",
      "source_primitive_id": "geometry.circle.hole-03",
      "target_primitive_id": "geometry.rectangle.plate",
      "confidence": 0.9,
      "measurements": {},
      "supporting_primitive_ids": []
    },
    {
      "relationship_id": "geometry.connected_to.hole-03.label",
      "type": "connected_to",
      "source_primitive_id": "geometry.text.hole-03",
      "target_primitive_id": "geometry.circle.hole-03",
      "confidence": 0.89,
      "measurements": {
        "role": "dimension_label"
      },
      "supporting_primitive_ids": []
    }
  ],
  "gaps": [],
  "provenance": {
    "extractor_id": "primitive-evidence-adapter",
    "extractor_version": "1.0.0",
    "backend": "geometry-v1:component_circle",
    "metadata_source": "domain_evidence_or_image_detection",
    "dependency_versions": {},
    "environment": {}
  },
  "metadata": {
    "source_extractor": "geometry-v1"
  }
}