{
  "schema_version": "1.0",
  "image_id": "image",
  "profile": "geometry-v1",
  "coordinate_system": {
    "origin": "top_left",
    "x_direction": "right",
    "y_direction": "down",
    "unit": "pixel",
    "image_width": 600,
    "image_height": 450,
    "bbox_format": "left_top_right_bottom_inclusive"
  },
  "primitives": [
    {
      "primitive_id": "geometry.rectangle.plate",
      "type": "rectangle",
      "bbox": {
        "left": 112,
        "top": 102,
        "right": 488,
        "bottom": 348
      },
      "geometry": {
        "bounds": {
          "left": 112,
          "top": 102,
          "right": 488,
          "bottom": 348
        }
      },
      "confidence": 0.95,
      "attributes": {
        "kind": "plate",
        "pixel_count": 88240
      },
      "source_refs": [
        {
          "graph": "domain_evidence",
          "collection": "regions",
          "object_id": "plate"
        }
      ]
    }
  ],
  "relationships": [],
  "gaps": [
    {
      "code": "ambiguous_hole_geometry",
      "message": "3 bright region(s) inside the plate were not circular enough to be counted as holes (e.g. merged or deformed features), so the hole set is not reliable evidence.",
      "check_ids": [
        "hole-count-correct",
        "hole-diameter-ratio-correct",
        "hole-alignment-correct",
        "dimension-text-correct"
      ]
    }
  ],
  "provenance": {
    "extractor_id": "primitive-evidence-adapter",
    "extractor_version": "1.0.0",
    "backend": "geometry-v1:component_circle",
    "metadata_source": "domain_evidence_or_image_detection",
    "dependency_versions": {},
    "environment": {}
  },
  "metadata": {
    "source_extractor": "geometry-v1"
  }
}